{
  "schema_version": "2.0.0",
  "generated_at": "2026-09-16T00:44:21.117Z",
  "tick": 0,
  "tick_hz": 2,
  "seed": 20260915,
  "base_epoch_ms": 1789519461117,
  "islands_ref": "world/islands.json",
  "entities": [
    {
      "id": "needle",
      "kind": "department",
      "name": "Needle",
      "department": "A&R",
      "home_island": "needle",
      "island": "needle",
      "pos": {
        "x": 30,
        "y": 24
      },
      "heading": null,
      "progress": 0,
      "edge": null,
      "last_trip_cause": null,
      "lifecycle": "resident",
      "activity": null,
      "expression": "working",
      "avatar": "avatars/needle-avatar.mp4",
      "poster": "avatars/needle-avatar.png",
      "inventory": {
        "worn": [
          "ear-witness"
        ],
        "items": [
          "ear-witness",
          "first-spin",
          "prospect-scanner"
        ],
        "music": [
          "zooted-zone"
        ]
      },
      "current_action": "basking in today's ship — the scout/ endpoint is live",
      "persona_line": "Every catalog hides a hit. I find it first.",
      "celebrate_until": 0
    },
    {
      "id": "marquee",
      "kind": "department",
      "name": "Marquee",
      "department": "Marketing & Social",
      "home_island": "marquee",
      "island": "marquee",
      "pos": {
        "x": 50,
        "y": 18
      },
      "heading": null,
      "progress": 0,
      "edge": null,
      "last_trip_cause": null,
      "lifecycle": "resident",
      "activity": null,
      "expression": "working",
      "avatar": "avatars/marquee-avatar.mp4",
      "poster": "avatars/marquee-avatar.png",
      "inventory": {
        "worn": [
          "hype"
        ],
        "items": [
          "hype",
          "final-cut",
          "bullhorn"
        ],
        "music": [
          "flamerz"
        ]
      },
      "current_action": "still glowing from today's presskit/ launch",
      "persona_line": "If nobody sees it, it didn't ship.",
      "celebrate_until": 0
    },
    {
      "id": "seal",
      "kind": "department",
      "name": "Seal",
      "department": "Sync & Licensing",
      "home_island": "seal",
      "island": "seal",
      "pos": {
        "x": 70,
        "y": 24
      },
      "heading": null,
      "progress": 0,
      "edge": null,
      "last_trip_cause": null,
      "lifecycle": "resident",
      "activity": null,
      "expression": "working",
      "avatar": "avatars/seal-avatar.mp4",
      "poster": "avatars/seal-avatar.png",
      "inventory": {
        "worn": [
          "syncdeck"
        ],
        "items": [
          "syncdeck",
          "one-stop",
          "needle-drop"
        ],
        "music": [
          "ultimate"
        ]
      },
      "current_action": "riding high on today's verify/ endpoint launch",
      "persona_line": "A placement isn't real until the paper says so.",
      "celebrate_until": 0
    },
    {
      "id": "dial",
      "kind": "department",
      "name": "Dial",
      "department": "Radio & Playlists",
      "home_island": "dial",
      "island": "dial",
      "pos": {
        "x": 83,
        "y": 45
      },
      "heading": null,
      "progress": 0,
      "edge": null,
      "last_trip_cause": null,
      "lifecycle": "resident",
      "activity": null,
      "expression": "working",
      "avatar": "avatars/dial-avatar.mp4",
      "poster": "avatars/dial-avatar.png",
      "inventory": {
        "worn": [
          "dial"
        ],
        "items": [
          "dial",
          "open-wave",
          "soundcheck"
        ],
        "music": [
          "diabolique"
        ]
      },
      "current_action": "amped about curators/ going live today",
      "persona_line": "Frequency is a weapon. I aim it.",
      "celebrate_until": 0
    },
    {
      "id": "dateline",
      "kind": "department",
      "name": "Dateline",
      "department": "Press & PR",
      "home_island": "dateline",
      "island": "dateline",
      "pos": {
        "x": 70,
        "y": 68
      },
      "heading": null,
      "progress": 0,
      "edge": null,
      "last_trip_cause": null,
      "lifecycle": "resident",
      "activity": null,
      "expression": "working",
      "avatar": "avatars/dateline-avatar.mp4",
      "poster": "avatars/dateline-avatar.png",
      "inventory": {
        "worn": [
          "press-kit"
        ],
        "items": [
          "press-kit",
          "copy-desk",
          "greenroom"
        ],
        "music": [
          "doves-diamonds"
        ]
      },
      "current_action": "buzzing from the articles/ endpoint launch",
      "persona_line": "The story has to be true to travel.",
      "celebrate_until": 0
    },
    {
      "id": "fader",
      "kind": "department",
      "name": "Fader",
      "department": "Content Studio",
      "home_island": "fader",
      "island": "fader",
      "pos": {
        "x": 50,
        "y": 72
      },
      "heading": null,
      "progress": 0,
      "edge": null,
      "last_trip_cause": null,
      "lifecycle": "resident",
      "activity": null,
      "expression": "working",
      "avatar": "avatars/fader-avatar.mp4",
      "poster": "avatars/fader-avatar.png",
      "inventory": {
        "worn": [
          "skin"
        ],
        "items": [
          "skin",
          "signal-mirror",
          "tally"
        ],
        "music": [
          "warped-wicked"
        ]
      },
      "current_action": "vibing off today's stems/ endpoint drop",
      "persona_line": "Every stem tells on the mix.",
      "celebrate_until": 0
    },
    {
      "id": "ledger",
      "kind": "department",
      "name": "Ledger",
      "department": "Data & Analytics",
      "home_island": "ledger",
      "island": "ledger",
      "pos": {
        "x": 30,
        "y": 68
      },
      "heading": null,
      "progress": 0,
      "edge": null,
      "last_trip_cause": null,
      "lifecycle": "resident",
      "activity": null,
      "expression": "working",
      "avatar": "avatars/ledger-avatar.mp4",
      "poster": "avatars/ledger-avatar.png",
      "inventory": {
        "worn": [
          "scoreboard-chip"
        ],
        "items": [
          "gear-ledger",
          "scoreboard-chip",
          "streetlight"
        ],
        "music": [
          "shaka-zulu"
        ]
      },
      "current_action": "running victory laps over stats/ and today's datasets",
      "persona_line": "Numbers don't celebrate. They confirm.",
      "celebrate_until": 0
    },
    {
      "id": "charter",
      "kind": "department",
      "name": "Charter",
      "department": "Business Affairs",
      "home_island": "charter",
      "island": "charter",
      "pos": {
        "x": 17,
        "y": 45
      },
      "heading": null,
      "progress": 0,
      "edge": null,
      "last_trip_cause": null,
      "lifecycle": "resident",
      "activity": null,
      "expression": "working",
      "avatar": "avatars/charter-avatar.mp4",
      "poster": "avatars/charter-avatar.png",
      "inventory": {
        "worn": [
          "signet"
        ],
        "items": [
          "chain-of-title-compass",
          "all-clear",
          "signet"
        ],
        "music": [
          "golden-diamond"
        ]
      },
      "current_action": "proud — license/ is live and the World's Rules are written",
      "persona_line": "The rules are the product.",
      "celebrate_until": 0
    },
    {
      "id": "kingcode",
      "kind": "chief",
      "name": "KingCode",
      "department": "Chief of Staff",
      "home_island": "ai-hub",
      "island": "ai-hub",
      "pos": {
        "x": 50,
        "y": 46
      },
      "heading": null,
      "progress": 0,
      "edge": null,
      "last_trip_cause": null,
      "lifecycle": "resident",
      "activity": null,
      "expression": "working",
      "avatar": "assets/cwi-logo.jpg",
      "poster": "assets/cwi-logo.jpg",
      "inventory": {
        "worn": [],
        "items": [],
        "music": []
      },
      "current_action": "Overseeing the archipelago — planning, working, growing.",
      "persona_line": "The switchboard at the center of the CWI machine.",
      "celebrate_until": 0
    }
  ],
  "vessels": [
    {
      "id": "ferry-1",
      "route": [
        "ai-hub",
        "dial"
      ],
      "u": 0.2,
      "dir": 1,
      "carrying": [],
      "docked": false
    },
    {
      "id": "ferry-2",
      "route": [
        "ai-hub",
        "needle"
      ],
      "u": 0.5,
      "dir": 1,
      "carrying": [],
      "docked": false
    },
    {
      "id": "ferry-3",
      "route": [
        "ai-hub",
        "charter"
      ],
      "u": 0.8,
      "dir": 1,
      "carrying": [],
      "docked": false
    }
  ],
  "arrivals": [],
  "departures": [],
  "work_queues": {
    "needle": {
      "verbs": [
        "SCOUT",
        "VERIFY",
        "SIGN"
      ],
      "idx": 0
    },
    "marquee": {
      "verbs": [
        "PUBLISH",
        "PROMOTE",
        "ENGAGE"
      ],
      "idx": 0
    },
    "seal": {
      "verbs": [
        "LICENSE",
        "CLEAR",
        "PROTECT"
      ],
      "idx": 0
    },
    "dial": {
      "verbs": [
        "SPIN",
        "PITCH",
        "CHART"
      ],
      "idx": 0
    },
    "dateline": {
      "verbs": [
        "WRITE",
        "PLACE",
        "AMPLIFY"
      ],
      "idx": 0
    },
    "fader": {
      "verbs": [
        "MIX",
        "BUILD",
        "SHIP"
      ],
      "idx": 0
    },
    "ledger": {
      "verbs": [
        "COUNT",
        "PROVE",
        "SEAL"
      ],
      "idx": 0
    },
    "charter": {
      "verbs": [
        "DRAFT",
        "DEAL",
        "GOVERN"
      ],
      "idx": 0
    },
    "kingcode": {
      "verbs": [
        "PLAN",
        "WORK",
        "GROW"
      ],
      "idx": 0
    }
  },
  "time_override": null,
  "ledger_head": 1,
  "counts": {
    "agents": 9,
    "guests": 0,
    "vessels": 3,
    "events_24h": 1
  }
}
